{
  "$schema": "https://json-schema.org/draft/2020-12/schema",
  "$id": "https://lyo.local/catalog/package.schema.json",
  "title": "Lyo package catalog entry",
  "type": "object",
  "required": [
    "id",
    "name",
    "area",
    "tagline",
    "description",
    "features",
    "examples",
    "sections",
    "links",
    "readmePath"
  ],
  "additionalProperties": false,
  "$defs": {
    "featureNode": {
      "oneOf": [
        {
          "type": "string",
          "description": "Flat feature bullet (markdown inline allowed)."
        },
        {
          "type": "object",
          "required": [
            "title"
          ],
          "additionalProperties": false,
          "properties": {
            "title": {
              "type": "string",
              "description": "Group or bullet label."
            },
            "text": {
              "type": "string",
              "description": "Optional short blurb after the title."
            },
            "items": {
              "type": "array",
              "items": {
                "$ref": "#/$defs/featureNode"
              },
              "description": "Nested bullets / subfeatures."
            }
          }
        }
      ]
    }
  },
  "properties": {
    "$schema": {
      "type": "string"
    },
    "id": {
      "type": "string",
      "minLength": 1
    },
    "name": {
      "type": "string",
      "minLength": 1
    },
    "area": {
      "type": "string",
      "enum": [
        "Core",
        "Data",
        "Communication",
        "Security",
        "Integration",
        "Plugins",
        "Apps",
        "Examples",
        "Tools",
        "Other"
      ]
    },
    "tagline": {
      "type": "string",
      "description": "One-line summary for root README bullets and portfolio cards."
    },
    "description": {
      "type": "string",
      "description": "Intro prose under the H1."
    },
    "features": {
      "type": "array",
      "items": {
        "$ref": "#/$defs/featureNode"
      }
    },
    "examples": {
      "type": "array",
      "items": {
        "type": "object",
        "required": [
          "title",
          "language",
          "code"
        ],
        "additionalProperties": false,
        "properties": {
          "title": {
            "type": "string"
          },
          "language": {
            "type": "string"
          },
          "code": {
            "type": "string"
          }
        }
      }
    },
    "benchmarks": {
      "type": "object",
      "additionalProperties": false,
      "properties": {
        "headline": {
          "type": "string"
        },
        "suite": {
          "type": "string",
          "description": "Portfolio benchmark suite id (e.g. compression)."
        },
        "items": {
          "type": "array",
          "items": {
            "type": "object",
            "required": [
              "label",
              "href"
            ],
            "additionalProperties": false,
            "properties": {
              "label": {
                "type": "string"
              },
              "href": {
                "type": "string",
                "description": "Portfolio path (e.g. /benchmarks/csv) or relative docs path."
              },
              "note": {
                "type": "string",
                "description": "Optional human note (docs link text). Featured highlights generate a note from the resolved measurement."
              },
              "featured": {
                "type": "boolean",
                "description": "When true, the item appears on the portfolio home page. Metric/detail are resolved from docs/benchmarks/data/{suite}.json — do not hardcode figures."
              },
              "method": {
                "type": "string",
                "description": "Micro suite: BenchmarkDotNet method name to resolve (requires suite)."
              },
              "params": {
                "type": "object",
                "additionalProperties": {
                  "type": "string"
                },
                "description": "Micro suite: [Params] key/values that must match the measurement (e.g. {\"RowCount\":\"100000\"})."
              },
              "scenario": {
                "type": "string",
                "description": "Load (k6) suite: scenario name to resolve (e.g. query_load)."
              },
              "primary": {
                "type": "string",
                "enum": [
                  "mean",
                  "throughput",
                  "p95",
                  "checks"
                ],
                "description": "Which live figure is the hero number. Defaults: throughput|mean (micro), p95 (load)."
              }
            }
          }
        }
      }
    },
    "sections": {
      "type": "array",
      "items": {
        "$ref": "section.schema.json"
      }
    },
    "dependencies": {
      "type": "array",
      "description": "Generated from ProjectReference / PackageReference (project graph model).",
      "items": {
        "type": "object",
        "required": [
          "name",
          "kind",
          "tags"
        ],
        "additionalProperties": false,
        "properties": {
          "name": {
            "type": "string"
          },
          "kind": {
            "type": "string",
            "enum": [
              "lyo",
              "package"
            ]
          },
          "version": {
            "type": [
              "string",
              "null"
            ]
          },
          "tags": {
            "type": "array",
            "items": {
              "type": "string"
            },
            "description": "direct|transitive, lyo|microsoft|third-party, plus TFMs like net10.0 / netstandard2.0"
          }
        }
      }
    },
    "targetFrameworks": {
      "type": "array",
      "description": "TargetFramework / TargetFrameworks from the project csproj.",
      "items": {
        "type": "string"
      }
    },
    "links": {
      "type": "array",
      "items": {
        "type": "object",
        "required": [
          "label",
          "href"
        ],
        "additionalProperties": false,
        "properties": {
          "label": {
            "type": "string"
          },
          "href": {
            "type": "string"
          }
        }
      }
    },
    "readmePath": {
      "type": "string"
    }
  }
}
