{
  "id": "Lyo.Authorization.Web.Components",
  "name": "Lyo.Authorization.Web.Components",
  "area": "Security",
  "tagline": "In-process Blazor grant list, editor, and check form.",
  "description": "Blazor UI for IGrantStore and IResourceAuthorization. The panel lists grants, the dialog saves one, and the check form asks whether a subject is allowed. A host without the store shows a warning. This package does not call HTTP and does not reference Lyo.Authentication.",
  "features": [
    "**GrantPanel** lists grants. Null resource id and tenant render as any. Include revoked and expired are off until toggled. AllowEdit defaults to false.",
    "**GrantEditDialog** treats a blank resource id or tenant as a wildcard, stores a guid resource id as lowercase D, and marks a local expiry as UTC without shifting the clock. A conflict leaves the dialog open.",
    "**GrantCheckForm** shows allow or deny. A store exception is an error, not a deny."
  ],
  "examples": [
    {
      "title": "Host",
      "language": "csharp",
      "code": "services.AddInMemoryAuthorization();\n// <GrantPanel AllowEdit=\"true\" />\n// <GrantCheckForm />"
    }
  ],
  "sections": [],
  "links": [],
  "readmePath": "Lyo.Net/Security/Authorization/Lyo.Authorization.Web.Components/README.md",
  "dependencies": [
    {
      "name": "Lyo.Authorization",
      "kind": "lyo",
      "tags": [
        "direct",
        "lyo"
      ]
    },
    {
      "name": "Lyo.Exceptions",
      "kind": "lyo",
      "tags": [
        "direct",
        "lyo"
      ]
    },
    {
      "name": "Lyo.Web.Components",
      "kind": "lyo",
      "tags": [
        "direct",
        "lyo"
      ]
    },
    {
      "name": "MudBlazor",
      "kind": "package",
      "version": "9.3",
      "tags": [
        "direct",
        "third-party"
      ]
    },
    {
      "name": "Lyo.Api.Client",
      "kind": "lyo",
      "tags": [
        "transitive",
        "lyo"
      ]
    },
    {
      "name": "Lyo.Api.Models",
      "kind": "lyo",
      "tags": [
        "transitive",
        "lyo"
      ]
    },
    {
      "name": "Lyo.Audit",
      "kind": "lyo",
      "tags": [
        "transitive",
        "lyo"
      ]
    },
    {
      "name": "Lyo.Common.Core",
      "kind": "lyo",
      "tags": [
        "transitive",
        "lyo"
      ]
    },
    {
      "name": "Lyo.Common.Metadata",
      "kind": "lyo",
      "tags": [
        "transitive",
        "lyo"
      ]
    },
    {
      "name": "Lyo.DataTable.Models",
      "kind": "lyo",
      "tags": [
        "transitive",
        "lyo"
      ]
    },
    {
      "name": "Lyo.DateAndTime",
      "kind": "lyo",
      "tags": [
        "transitive",
        "lyo"
      ]
    },
    {
      "name": "Lyo.Diagnostic",
      "kind": "lyo",
      "tags": [
        "transitive",
        "lyo"
      ]
    },
    {
      "name": "Lyo.Encryption",
      "kind": "lyo",
      "tags": [
        "transitive",
        "lyo"
      ]
    },
    {
      "name": "Lyo.EntityReference.Models",
      "kind": "lyo",
      "tags": [
        "transitive",
        "lyo"
      ]
    },
    {
      "name": "Lyo.Hashing",
      "kind": "lyo",
      "tags": [
        "transitive",
        "lyo"
      ]
    },
    {
      "name": "Lyo.Health",
      "kind": "lyo",
      "tags": [
        "transitive",
        "lyo"
      ]
    },
    {
      "name": "Lyo.Http.Client",
      "kind": "lyo",
      "tags": [
        "transitive",
        "lyo"
      ]
    },
    {
      "name": "Lyo.IO.FileSystem",
      "kind": "lyo",
      "tags": [
        "transitive",
        "lyo"
      ]
    },
    {
      "name": "Lyo.IO.Temp",
      "kind": "lyo",
      "tags": [
        "transitive",
        "lyo"
      ]
    },
    {
      "name": "Lyo.Json",
      "kind": "lyo",
      "tags": [
        "transitive",
        "lyo"
      ]
    },
    {
      "name": "Lyo.KeyStore",
      "kind": "lyo",
      "tags": [
        "transitive",
        "lyo"
      ]
    },
    {
      "name": "Lyo.Metrics",
      "kind": "lyo",
      "tags": [
        "transitive",
        "lyo"
      ]
    },
    {
      "name": "Lyo.PackageMetadata",
      "kind": "lyo",
      "tags": [
        "transitive",
        "lyo"
      ]
    },
    {
      "name": "Lyo.Parameters",
      "kind": "lyo",
      "tags": [
        "transitive",
        "lyo"
      ]
    },
    {
      "name": "Lyo.Query.Evaluation",
      "kind": "lyo",
      "tags": [
        "transitive",
        "lyo"
      ]
    },
    {
      "name": "Lyo.Query.Models",
      "kind": "lyo",
      "tags": [
        "transitive",
        "lyo"
      ]
    },
    {
      "name": "Lyo.Result",
      "kind": "lyo",
      "tags": [
        "transitive",
        "lyo"
      ]
    },
    {
      "name": "Lyo.Schedule.Models",
      "kind": "lyo",
      "tags": [
        "transitive",
        "lyo"
      ]
    },
    {
      "name": "Lyo.Streams",
      "kind": "lyo",
      "tags": [
        "transitive",
        "lyo"
      ]
    },
    {
      "name": "Lyo.Validation",
      "kind": "lyo",
      "tags": [
        "transitive",
        "lyo"
      ]
    },
    {
      "name": "Lyo.Validation.Models",
      "kind": "lyo",
      "tags": [
        "transitive",
        "lyo"
      ]
    },
    {
      "name": "Lyo.Web.Primitives",
      "kind": "lyo",
      "tags": [
        "transitive",
        "lyo"
      ]
    },
    {
      "name": "AngleSharp",
      "kind": "package",
      "version": "1.5.0",
      "tags": [
        "transitive",
        "third-party"
      ]
    },
    {
      "name": "Blazored.LocalStorage",
      "kind": "package",
      "version": "4.5.0",
      "tags": [
        "transitive",
        "third-party"
      ]
    },
    {
      "name": "BouncyCastle.Cryptography",
      "kind": "package",
      "version": "2.6.2",
      "tags": [
        "transitive",
        "third-party",
        "netstandard2.0"
      ]
    },
    {
      "name": "Konscious.Security.Cryptography.Argon2",
      "kind": "package",
      "version": "1.3.1",
      "tags": [
        "transitive",
        "third-party"
      ]
    },
    {
      "name": "Microsoft.Bcl.AsyncInterfaces",
      "kind": "package",
      "version": "10.0.5",
      "tags": [
        "transitive",
        "microsoft",
        "netstandard2.0"
      ]
    },
    {
      "name": "Microsoft.Extensions.Configuration.Binder",
      "kind": "package",
      "version": "10.0.5",
      "tags": [
        "transitive",
        "microsoft"
      ]
    },
    {
      "name": "Microsoft.Extensions.DependencyInjection.Abstractions",
      "kind": "package",
      "version": "10.0.5",
      "tags": [
        "transitive",
        "microsoft",
        "net10.0",
        "netstandard2.0"
      ]
    },
    {
      "name": "Microsoft.Extensions.Hosting.Abstractions",
      "kind": "package",
      "version": "10.0.5",
      "tags": [
        "transitive",
        "microsoft"
      ]
    },
    {
      "name": "Microsoft.Extensions.Http",
      "kind": "package",
      "version": "10.0.5",
      "tags": [
        "transitive",
        "microsoft"
      ]
    },
    {
      "name": "Microsoft.Extensions.Logging.Abstractions",
      "kind": "package",
      "version": "10.0.5",
      "tags": [
        "transitive",
        "microsoft"
      ]
    },
    {
      "name": "System.Buffers",
      "kind": "package",
      "version": "4.6.1",
      "tags": [
        "transitive",
        "microsoft",
        "netstandard2.0"
      ]
    },
    {
      "name": "System.ComponentModel.Annotations",
      "kind": "package",
      "version": "5.0.0",
      "tags": [
        "transitive",
        "microsoft"
      ]
    },
    {
      "name": "System.IO.Hashing",
      "kind": "package",
      "version": "10.0.5",
      "tags": [
        "transitive",
        "microsoft",
        "net10.0"
      ]
    },
    {
      "name": "System.Memory",
      "kind": "package",
      "version": "4.6.3",
      "tags": [
        "transitive",
        "microsoft",
        "netstandard2.0"
      ]
    },
    {
      "name": "System.Text.Encoding.CodePages",
      "kind": "package",
      "version": "10.0.5",
      "tags": [
        "transitive",
        "microsoft"
      ]
    },
    {
      "name": "System.Text.Json",
      "kind": "package",
      "version": "10.0.5",
      "tags": [
        "transitive",
        "microsoft",
        "netstandard2.0"
      ]
    },
    {
      "name": "System.Threading.RateLimiting",
      "kind": "package",
      "version": "10.0.5",
      "tags": [
        "transitive",
        "microsoft"
      ]
    },
    {
      "name": "System.Threading.Tasks.Extensions",
      "kind": "package",
      "version": "4.6.3",
      "tags": [
        "transitive",
        "microsoft",
        "netstandard2.0"
      ]
    }
  ],
  "targetFrameworks": [
    "net10.0"
  ]
}
