{
  "id": "Lyo.Api.Import.Yaml",
  "name": "Lyo.Api.Import.Yaml",
  "area": "Apps",
  "tagline": "Yaml handler for Lyo.Api.Import.",
  "description": "Registers a Yaml import handler. The document is converted to JSON, then the JSON importer applies the field map.",
  "features": [
    "AddYamlImport registers IYamlService and the Yaml handler."
  ],
  "examples": [
    {
      "title": "Registration",
      "language": "csharp",
      "code": "services.AddLyoApiImport();\nservices.AddYamlImport();"
    }
  ],
  "sections": [],
  "links": [],
  "readmePath": "Lyo.Net/Apps/Api/Import/Lyo.Api.Import.Yaml/README.md",
  "dependencies": [
    {
      "name": "Lyo.Api.Import",
      "kind": "lyo",
      "tags": [
        "direct",
        "lyo"
      ]
    },
    {
      "name": "Lyo.Yaml",
      "kind": "lyo",
      "tags": [
        "direct",
        "lyo"
      ]
    },
    {
      "name": "Lyo.Api.Models",
      "kind": "lyo",
      "tags": [
        "transitive",
        "lyo"
      ]
    },
    {
      "name": "Lyo.Common.Core",
      "kind": "lyo",
      "tags": [
        "transitive",
        "lyo"
      ]
    },
    {
      "name": "Lyo.Common.Metadata",
      "kind": "lyo",
      "tags": [
        "transitive",
        "lyo"
      ]
    },
    {
      "name": "Lyo.DateAndTime",
      "kind": "lyo",
      "tags": [
        "transitive",
        "lyo"
      ]
    },
    {
      "name": "Lyo.Exceptions",
      "kind": "lyo",
      "tags": [
        "transitive",
        "lyo"
      ]
    },
    {
      "name": "Lyo.Json",
      "kind": "lyo",
      "tags": [
        "transitive",
        "lyo"
      ]
    },
    {
      "name": "Lyo.Parameters",
      "kind": "lyo",
      "tags": [
        "transitive",
        "lyo"
      ]
    },
    {
      "name": "Lyo.Query.Models",
      "kind": "lyo",
      "tags": [
        "transitive",
        "lyo"
      ]
    },
    {
      "name": "Microsoft.Bcl.AsyncInterfaces",
      "kind": "package",
      "version": "10.0.5",
      "tags": [
        "transitive",
        "microsoft",
        "netstandard2.0"
      ]
    },
    {
      "name": "System.Memory",
      "kind": "package",
      "version": "4.6.3",
      "tags": [
        "transitive",
        "microsoft",
        "netstandard2.0"
      ]
    },
    {
      "name": "System.Text.Encoding.CodePages",
      "kind": "package",
      "version": "10.0.5",
      "tags": [
        "transitive",
        "microsoft"
      ]
    },
    {
      "name": "System.Text.Json",
      "kind": "package",
      "version": "10.0.5",
      "tags": [
        "transitive",
        "microsoft",
        "netstandard2.0"
      ]
    },
    {
      "name": "YamlDotNet",
      "kind": "package",
      "version": "18.1.0",
      "tags": [
        "transitive",
        "third-party"
      ]
    }
  ],
  "targetFrameworks": [
    "net10.0"
  ]
}
