{
  "id": "Lyo.Validation.Postgres",
  "name": "Lyo.Validation.Postgres",
  "area": "Core",
  "tagline": "PostgreSQL store for `ValidationSchema` documents (WhereClause JSONB) behind `IValidationSchemaStore`.",
  "description": "PostgreSQL + EF Core implementation of [`IValidationSchemaStore`](../Lyo.Validation/README.md). Named validation schemas live in schema `validation`, table `schema`, with `constraints_json` / `messages_json` as jsonb.\n\n**Archetype A (Lyo domain).** Hosts expose or fetch `ValidationSchema` JSON on their own API. This package is the database backend only.",
  "features": [
    "**PostgresValidationSchemaStore.** `IValidationSchemaStore` backed by `IDbContextFactory<ValidationDbContext>`.",
    "**JSONB WhereClause.** The same AST query filters use (`In`, `NotIn`, `Regex`, groups).",
    "**Unique key.** `key` is constrained by `ux_validation_schema_key`."
  ],
  "examples": [
    {
      "title": "Registration",
      "language": "csharp",
      "code": "services.AddPostgresValidationStoreFromConfiguration(configuration);"
    }
  ],
  "sections": [
    {
      "type": "paragraph",
      "title": "Database schema",
      "text": "PostgreSQL schema `validation`. Table `schema` columns: `id`, unique `key`, `target_type_name`, `description`, `constraints_json` (WhereClause), `messages_json`, timestamps. Migrations history lives in `__EFMigrationsHistory` in the same schema."
    },
    {
      "type": "paragraph",
      "title": "Migrations",
      "text": "At design time set `VALIDATION_CONNECTION_STRING` and run `dotnet ef migrations add MigrationName --project Core/Validation/Lyo.Validation.Postgres --context ValidationDbContext`."
    }
  ],
  "links": [],
  "readmePath": "Lyo.Net/Core/Validation/Lyo.Validation.Postgres/README.md",
  "dependencies": [
    {
      "name": "Lyo.Exceptions",
      "kind": "lyo",
      "tags": [
        "direct",
        "lyo"
      ]
    },
    {
      "name": "Lyo.Json",
      "kind": "lyo",
      "tags": [
        "direct",
        "lyo"
      ]
    },
    {
      "name": "Lyo.Postgres",
      "kind": "lyo",
      "tags": [
        "direct",
        "lyo"
      ]
    },
    {
      "name": "Lyo.Query.Models",
      "kind": "lyo",
      "tags": [
        "direct",
        "lyo"
      ]
    },
    {
      "name": "Lyo.Validation",
      "kind": "lyo",
      "tags": [
        "direct",
        "lyo"
      ]
    },
    {
      "name": "Microsoft.EntityFrameworkCore.Design",
      "kind": "package",
      "version": "10.0.5",
      "tags": [
        "direct",
        "microsoft"
      ]
    },
    {
      "name": "Microsoft.Extensions.Configuration.Binder",
      "kind": "package",
      "version": "10.0.5",
      "tags": [
        "direct",
        "microsoft"
      ]
    },
    {
      "name": "Lyo.Common.Core",
      "kind": "lyo",
      "tags": [
        "transitive",
        "lyo"
      ]
    },
    {
      "name": "Lyo.Common.Metadata",
      "kind": "lyo",
      "tags": [
        "transitive",
        "lyo"
      ]
    },
    {
      "name": "Lyo.Health",
      "kind": "lyo",
      "tags": [
        "transitive",
        "lyo"
      ]
    },
    {
      "name": "Lyo.Metrics",
      "kind": "lyo",
      "tags": [
        "transitive",
        "lyo"
      ]
    },
    {
      "name": "Lyo.Parameters",
      "kind": "lyo",
      "tags": [
        "transitive",
        "lyo"
      ]
    },
    {
      "name": "Lyo.Query.Evaluation",
      "kind": "lyo",
      "tags": [
        "transitive",
        "lyo"
      ]
    },
    {
      "name": "Lyo.Result",
      "kind": "lyo",
      "tags": [
        "transitive",
        "lyo"
      ]
    },
    {
      "name": "Lyo.Validation.Models",
      "kind": "lyo",
      "tags": [
        "transitive",
        "lyo"
      ]
    },
    {
      "name": "Microsoft.Bcl.AsyncInterfaces",
      "kind": "package",
      "version": "10.0.5",
      "tags": [
        "transitive",
        "microsoft",
        "netstandard2.0"
      ]
    },
    {
      "name": "Microsoft.EntityFrameworkCore",
      "kind": "package",
      "version": "10.0.5",
      "tags": [
        "transitive",
        "microsoft"
      ]
    },
    {
      "name": "Microsoft.EntityFrameworkCore.Relational",
      "kind": "package",
      "version": "10.0.5",
      "tags": [
        "transitive",
        "microsoft"
      ]
    },
    {
      "name": "Microsoft.Extensions.DependencyInjection.Abstractions",
      "kind": "package",
      "version": "10.0.5",
      "tags": [
        "transitive",
        "microsoft"
      ]
    },
    {
      "name": "Microsoft.Extensions.Hosting.Abstractions",
      "kind": "package",
      "version": "10.0.5",
      "tags": [
        "transitive",
        "microsoft"
      ]
    },
    {
      "name": "Microsoft.Extensions.Options",
      "kind": "package",
      "version": "10.0.5",
      "tags": [
        "transitive",
        "microsoft"
      ]
    },
    {
      "name": "Npgsql.EntityFrameworkCore.PostgreSQL",
      "kind": "package",
      "version": "10.0.3",
      "tags": [
        "transitive",
        "third-party"
      ]
    },
    {
      "name": "System.ComponentModel.Annotations",
      "kind": "package",
      "version": "5.0.0",
      "tags": [
        "transitive",
        "microsoft"
      ]
    },
    {
      "name": "System.Memory",
      "kind": "package",
      "version": "4.6.3",
      "tags": [
        "transitive",
        "microsoft",
        "netstandard2.0"
      ]
    },
    {
      "name": "System.Text.Encoding.CodePages",
      "kind": "package",
      "version": "10.0.5",
      "tags": [
        "transitive",
        "microsoft"
      ]
    },
    {
      "name": "System.Text.Json",
      "kind": "package",
      "version": "10.0.5",
      "tags": [
        "transitive",
        "microsoft",
        "netstandard2.0"
      ]
    }
  ],
  "targetFrameworks": [
    "net10.0"
  ]
}
