{
  "id": "Lyo.Tts.AwsPolly",
  "name": "Lyo.Tts.AwsPolly",
  "area": "Communication",
  "tagline": "Amazon Polly integration: `AwsPollyTtsService` extends `TtsServiceBase<AwsPollyTtsRequest>` with voice selection, output formats, bulk synthesis, metrics, and DI helpers.",
  "description": "[Amazon Polly](https://docs.aws.amazon.com/polly/) integration: `AwsPollyTtsService` extends `TtsServiceBase<AwsPollyTtsRequest>` with voice selection, output formats, bulk synthesis, metrics, and DI helpers.\n\n**Target frameworks:** `netstandard2.0`, `net10.0`",
  "features": [],
  "examples": [
    {
      "title": "Quick start (code)",
      "language": "csharp",
      "code": "using Lyo.Common.Enums;\nusing Lyo.Common.Records;\nusing Lyo.Tts.AwsPolly;\n\nvar options = new AwsPollyOptions\n{\n    Region = \"us-east-1\",\n    DefaultVoiceId = nameof(AwsPollyVoiceId.Joanna),\n    DefaultLanguageCode = LanguageCodeInfo.EnUs,\n    DefaultOutputFormat = AudioFormat.Mp3\n};\n\nawait using var service = new AwsPollyTtsService(options);\nvar result = await service.SynthesizeAsync(\"Hello, world!\");\n\nif (result.IsSuccess && result.AudioData is { Length: > 0 })\n{\n    await File.WriteAllBytesAsync(\"out.mp3\", result.AudioData);\n}"
    },
    {
      "title": "Register with DI",
      "language": "csharp",
      "code": "using Lyo.Tts.AwsPolly;\n\n// Configuration-bound registration: registers IAmazonPolly + AwsPollyOptions if missing,\n// then registers AwsPollyTtsService, ITtsService<AwsPollyTtsRequest>, AwsPollyTtsAppService, ITtsService.\nservices.AddAwsPollyTtsServiceFromConfiguration(configuration);\n\n// Or with an inline configurator (also registers AwsPollyTtsAppService + ITtsService):\nservices.AddAwsPollyTtsService(options =>\n{\n    options.Region = \"us-east-1\";\n    options.DefaultVoiceId = nameof(AwsPollyVoiceId.Joanna);\n});\n\n// AddAmazonPollyFromConfiguration is also exposed on its own for hosts that want to\n// register IAmazonPolly + AwsPollyOptions without the Lyo TTS surface.\nservices.AddAmazonPollyFromConfiguration(configuration);"
    }
  ],
  "sections": [
    {
      "type": "paragraph",
      "title": "Quick start (code)",
      "text": "Prefer **IAM roles**, environment credentials, or the shared credentials file instead of embedding `AccessKeyId` / `SecretAccessKey`."
    },
    {
      "type": "list",
      "title": "Dependency injection",
      "items": [
        "`AwsPollyTtsService` (the singleton implementation, subclass of `TtsServiceBase<AwsPollyTtsRequest>`).",
        "`ITtsService<AwsPollyTtsRequest>` resolved from the singleton above.",
        "`AwsPollyTtsAppService` — a thin adapter that converts `TtsResult<AwsPollyTtsRequest>` into `TtsSynthesisResult`.",
        "`ITtsService` (non-generic) backed by `AwsPollyTtsAppService`, so callers that only need the simple contract can resolve it directly without referencing the Polly-specific types."
      ]
    },
    {
      "type": "table",
      "title": "Behaviour notes",
      "headers": [
        "Area",
        "Detail"
      ],
      "rows": [
        [
          "Voices",
          "`AwsPollyVoiceId` maps to Polly [`VoiceId`](https://docs.aws.amazon.com/polly/latest/dg/voicelist.html) values"
        ],
        [
          "Language",
          "`LanguageCode` on `AwsPollyTtsRequest` is primarily for selection; a fixed `VoiceId` determines spoken language"
        ],
        [
          "Metrics",
          "`Constants.Metrics` uses `tts.awspolly.*` keys (distinct from [`Lyo.Tts`](../Lyo.Tts/README.md))"
        ],
        [
          "Adapter",
          "`AwsPollyTtsAppService` adapts `AwsPollyTtsService` to `ITtsService.SynthesizeAsync(text, voiceId)`, surfacing the first error message on failure and audio bytes on success"
        ]
      ]
    }
  ],
  "links": [],
  "readmePath": "Lyo.Net/Communication/Speech/Lyo.Tts.AwsPolly/README.md",
  "dependencies": [
    {
      "name": "Lyo.Exceptions",
      "kind": "lyo",
      "tags": [
        "direct",
        "lyo"
      ]
    },
    {
      "name": "Lyo.Tts",
      "kind": "lyo",
      "tags": [
        "direct",
        "lyo"
      ]
    },
    {
      "name": "AWSSDK.Polly",
      "kind": "package",
      "version": "4.0.100.3",
      "tags": [
        "direct",
        "third-party"
      ]
    },
    {
      "name": "Microsoft.Extensions.Configuration.Binder",
      "kind": "package",
      "version": "10.0.5",
      "tags": [
        "direct",
        "microsoft"
      ]
    },
    {
      "name": "Microsoft.Extensions.Logging.Abstractions",
      "kind": "package",
      "version": "10.0.5",
      "tags": [
        "direct",
        "microsoft"
      ]
    },
    {
      "name": "Microsoft.Extensions.Options",
      "kind": "package",
      "version": "10.0.5",
      "tags": [
        "direct",
        "microsoft"
      ]
    },
    {
      "name": "Lyo.Common",
      "kind": "lyo",
      "tags": [
        "transitive",
        "lyo"
      ]
    },
    {
      "name": "Lyo.Metrics",
      "kind": "lyo",
      "tags": [
        "transitive",
        "lyo"
      ]
    },
    {
      "name": "Lyo.Result",
      "kind": "lyo",
      "tags": [
        "transitive",
        "lyo"
      ]
    },
    {
      "name": "Lyo.Tts.Models",
      "kind": "lyo",
      "tags": [
        "transitive",
        "lyo"
      ]
    },
    {
      "name": "Microsoft.Extensions.DependencyInjection.Abstractions",
      "kind": "package",
      "version": "10.0.5",
      "tags": [
        "transitive",
        "microsoft"
      ]
    },
    {
      "name": "Microsoft.Extensions.Options.ConfigurationExtensions",
      "kind": "package",
      "version": "10.0.5",
      "tags": [
        "transitive",
        "microsoft"
      ]
    },
    {
      "name": "System.Memory",
      "kind": "package",
      "version": "4.6.3",
      "tags": [
        "transitive",
        "microsoft",
        "netstandard2.0"
      ]
    },
    {
      "name": "System.Text.Json",
      "kind": "package",
      "version": "10.0.5",
      "tags": [
        "transitive",
        "microsoft",
        "netstandard2.0"
      ]
    }
  ],
  "targetFrameworks": [
    "netstandard2.0",
    "net10.0"
  ]
}
