{
  "id": "Lyo.Images.OpenCv",
  "name": "Lyo.Images.OpenCv",
  "area": "Data",
  "tagline": "OpenCV helpers for .NET via **OpenCvSharp4**, kept separate from higher-level pipelines (e.g. comic overlay) so hosts can reference native OpenCV only where needed.",
  "description": "OpenCV helpers for .NET via **OpenCvSharp4**, kept separate from higher-level pipelines (e.g. comic overlay) so hosts can reference native OpenCV only where needed.",
  "features": [],
  "examples": [],
  "sections": [
    {
      "type": "markdown",
      "title": "ROI inpaint",
      "body": "**Contract:** [`IOpenCvRoiInpaint`](IOpenCvRoiInpaint.cs) — [`InpaintColorRoiPng`](IOpenCvRoiInpaint.cs) decodes a **color PNG ROI**, builds a binary mask (255 inside the\nrectangle, 0 elsewhere), runs OpenCV inpaint with optional **Telea** or **Navier–Stokes** ([`OpenCvInpaintAlgorithm`](OpenCvInpaintAlgorithm.cs)), and returns PNG-encoded **BGR**\noutput with the **same width and height** as the decoded source.\n\n- **Without DI:** [`OpenCvRoiInpaint`](OpenCvRoiInpaint.cs) (`InpaintColorRoiPng`, `InpaintTelea`) delegates to a shared [`OpenCvRoiInpaintService`](OpenCvRoiInpaintService.cs).\n- **With DI:** [`AddOpenCvRoiInpaint()`](OpenCvImageServiceCollectionExtensions.cs) registers `IOpenCvRoiInpaint` → `OpenCvRoiInpaintService` if not already registered.\n\nFailure codes: **`OpenCvInpaint.DecodeFailed`**, **`OpenCvInpaint.InpaintError`**."
    },
    {
      "type": "paragraph",
      "title": "Native runtimes (NuGet)",
      "text": "This package references **`OpenCvSharp4.official.runtime.linux-x64`**, suitable for Linux CI and local Linux development. On **Windows** (or other RIDs), add a matching official runtime package to the **executable** project (e.g. Gateway) or to this library’s `.csproj`, for example search NuGet for `OpenCvSharp4.official.runtime` for your OS. If native libraries fail to load at runtime, verify the correct runtime package is restored and copied next to the app output."
    },
    {
      "type": "markdown",
      "title": "Tests",
      "body": "See [`../Lyo.Images.OpenCv.Tests/`](../Lyo.Images.OpenCv.Tests/). This repo uses **xUnit v3** with `OutputType` **Exe**; run:\n\n```bash\ndotnet run --project Lyo.Net/Data/Images/Lyo.Images.OpenCv.Tests/Lyo.Images.OpenCv.Tests.csproj\n```\n\n(`dotnet test` may restore but not always execute the v3 in-process runner the same way—prefer `dotnet run` for this project.)\n\nTests require a working OpenCV native load (same as production use on Linux)."
    }
  ],
  "links": [],
  "readmePath": "Lyo.Net/Data/Images/Lyo.Images.OpenCv/README.md",
  "dependencies": [
    {
      "name": "Lyo.Exceptions",
      "kind": "lyo",
      "tags": [
        "direct",
        "lyo"
      ]
    },
    {
      "name": "Lyo.Result",
      "kind": "lyo",
      "tags": [
        "direct",
        "lyo"
      ]
    },
    {
      "name": "Microsoft.Extensions.DependencyInjection",
      "kind": "package",
      "version": "10.0.5",
      "tags": [
        "direct",
        "microsoft"
      ]
    },
    {
      "name": "OpenCvSharp4",
      "kind": "package",
      "version": "4.13.0.20260627",
      "tags": [
        "direct",
        "third-party"
      ]
    },
    {
      "name": "OpenCvSharp4.official.runtime.linux-x64",
      "kind": "package",
      "version": "4.13.0.20260627",
      "tags": [
        "direct",
        "third-party"
      ]
    },
    {
      "name": "Lyo.Common",
      "kind": "lyo",
      "tags": [
        "transitive",
        "lyo"
      ]
    },
    {
      "name": "Microsoft.Extensions.Logging.Abstractions",
      "kind": "package",
      "version": "10.0.5",
      "tags": [
        "transitive",
        "microsoft"
      ]
    },
    {
      "name": "System.Memory",
      "kind": "package",
      "version": "4.6.3",
      "tags": [
        "transitive",
        "microsoft",
        "netstandard2.0"
      ]
    },
    {
      "name": "System.Text.Json",
      "kind": "package",
      "version": "10.0.5",
      "tags": [
        "transitive",
        "microsoft",
        "netstandard2.0"
      ]
    }
  ],
  "targetFrameworks": [
    "net10.0"
  ]
}
