{
  "id": "Lyo.Music.Seed",
  "name": "Lyo.Music.Seed",
  "area": "Plugins",
  "tagline": "EF seed of music genres, formats, release groups, releases, tracks, and credits.",
  "description": "EF seed of a few genres and formats, then Count release groups. Each group has one release and two tracks, each with its own recording and a track credit. Schema music.",
  "features": [],
  "examples": [],
  "sections": [],
  "links": [],
  "readmePath": "Lyo.Net/Plugins/Music/Lyo.Music.Seed/README.md",
  "dependencies": [],
  "targetFrameworks": [
    "net10.0"
  ]
}
